,original,paraphrase,similar
274,يشبه عطارد قمر الأرض في شكله، إذ يحوي العديد من الفوهات الصدمية، ومناطق سهلية ناعمة، ولا يوجد له أقمار طبيعية أو غلاف جوي، ولكنه يملك نواة حديدية على عكس القمر مما يؤدي إلى توليد حقل مغناطيسي يساوي 1% من قيمة الحقل المغناطيس للأرض.,يشبه عطارد قمر الأرض في شكله ، حيث يحتوي على العديد من الفوهات الصدمية ، وليس له أقمار طبيعية أو غلاف جوي ، لكن له قلب حديدي ، مما يؤدي إلى توليد مجال مغناطيسي يساوي 1٪ من القمر.,True
439,لِلبرمائيَّات شبهٌ ظاهريٌّ بِالعظايا، على أنَّ الأخيرة بِالإضافة إلى الثدييَّات والطُيُور تنتمي إلى الفرع الحيوي المعروف بِالسلويَّات، وهي الكائنات التي تضع صغارًا مُغلَّفةً بِغشاءٍ سلويّ، ولا تحتاج لِبيئةٍ مائيَّة لِلحفاظ على ذُريَّتها.,قدرت مبيعات الطبعة الأولى من الرواية بمئتي ألف نسخة ، وبحلول فبراير من عام 2010 وصلت إلى ثمانمائة ألف نسخة.,False
147,صدر ألبوم لووس في معظم أنحاء العالم بتاريخ 20 يونيو 2006.,نظرًا لأن التلسكوبات الأرضية لا تكشف إلا الأجزاء الهلالية من سطح عطارد ، فهناك القليل من المعلومات المتاحة.,False
448,ظهرت أولى البرمائيَّات خلال العصر الديڤوني، مُتطوِّرةً من الأسماك لحميَّة الزعانف ذات الرئتين والأطراف العظميَّة، وهي خصائصٌ جسديَّة ساعدتها على التأقلم مع الحياة على اليابسة.,ظهر الأول خلال العصر الديفوني ، حيث تطورت من الأسماك ذات العظام والرئتين ، مما ساعدها على التكيف مع الحياة على الأرض.,True
314,وهكذا أخذت صُورة الوضع السياسي لِلدولة الإسلاميَّة الجديدة في الأندلُس تتوضَّح تحت حُكم مُحمَّدِ بن الأحمر، الذي اتخذ غرناطة عاصمةً لهُ بدلاً من جيَّان التي كانت واقعةً تحت تهديد النصارى المُستمر.,البرمائيات لها تشابه واضح مع السحالي ، لكن الثدييات والطيور تنتمي أيضًا إلى الفرع البيولوجي المعروف باسم amniotes ، وهي كائنات تعيش صغارًا مغطاة بغشاء يحيط بالجنين ، ولا تحتاج إلى بيئة مائية للحفاظ على نسلها.,False
464,تتكوَّن هذه الطائفة اليوم من ثلاث رُتب: عديمات الأذيال (الضفادع والعلاجيم) وذوات الأذيال (السَّمادر أو السمادل) وعديمات الأرجل.,بعد سقوط بغداد بعد حصار استمر لأيام ، استولى الخليفة المستو على المدينة.,False
301,"وكان الفلكيون القدماء يعتقدون بأن ""برية هرمس الهرامسة"" (باللاتينية: Solitudo Hermae Trismegisti) تُشكل ميزة أساسية من ميزات الكوكب، حيث قيل بأنها تغطي تقريباً ربع ربعه الجنوبي الشرقي.","يُعتقد أن ""Wilitudo Hermae Trismegisti"" هي سمة رئيسية للكوكب ، حيث قيل إنها تغطي ما يقرب من ربع الربع الجنوبي الشرقي.",True
124,بينما أصبح مدفن الحسـين في كربلاء مكاناً مقدساً لدى الشيعة يزوره مؤمنوهم، مع ما يرافق ذلك من ترديد لأدعية خاصة أثناء كل زيارة لقبره.,أصبحت مقبرة الحسن في كربلاء مقدسا للشيعة بسبب تكرار الصلوات الخاصة عند زيارة قبره.,True
226,حيث تلعب الصناعات التكنولوجية بها دورا محوريا في اقتصاد العالم.,كانت مملكة غرناطة هي الأطول عمراً بين الدول الإسلامية في الأندلس ، كما استطاعت أن تحقق نجاحات حضارية وإنجازات ملحوظة تضاهي نجاحات الدول الأندلسية التي سبقتها.,False
346,ومن أبرز المعالم الحضاريَّة في هذه المملكة قلعة ومسجد وقصر الحمراء الذي يُعد أحد أروع المعالم المعماريَّة في العالم، بُني لِتلبية احتياجاتٍ مُتعدِّدةٍ، فهو على الصعيد العسكري قلعةً منيعة الأسوار استطاع أُمراء غرناطة بفضلها الحفاظ على مملكتهم من الأطماع العسكرية طيلة قرنين ونيفٍ، ومن جهةٍ أُخرى صُمم لِيكون دار الإمارة ومسجداً جامعاً كبيراً، كان في أوج ازدهار المملكة منبع العُلماء ومُلتقى الدارسين من بلاد الأندلُس والمغرب، وتخرج منه عُلماء كبارٌ من أبرزهم العلَّامة الإمام الشاطبي، إبراهيم بن موسى (ت.,يعد قصر الحمراء من أروع المعالم المعمارية في العالم ، ويعد من أبرز المعالم الثقافية في هذه المملكة.,True
430,وتصحب التغيُّرات الخارجيَّة تغيُّراتٌ داخليَّةٌ أيضًا يتحوَّلُ فرخُ البرمائيّ فيها، باستثناء بعض الأنواع الأرضيَّة من الضفادع والسَّمادر، من التنفُّس بِالخياشيم إلى التنفُّس بِالرئتين.,ألعاب الجوع هو مهرجان سنوي يتم فيه اختيار فتى وفتاة بالقرعة من كل مقاطعة من المقاطعات الاثني عشر المحيطة بمبنى الكابيتول ، للقتال حتى الموت في برنامج تلفزيون الواقع ، وهناك فائز واحد فقط يمكنه البقاء.,False
327,فقد استمرَّت مملكة قشتالة تبتلع البلاد التابعة لِغرناطة حتَّى حاصرها الملكان الكاثوليكيان فرديناند الثاني الأرغوني وإيزابيلَّا الأولى القشتاليَّة في جُمادى الآخرة 896هـ المُوافق فيه نيسان (أبريل) 1491م، وبعد سبعة أشهُرٍ من الحصار دبَّ اليأس في نُفُوس المُسلمين وانتشر الجوع وتفشَّت الأمراض في صُفُوفهم، فأبرم آخر الأُمراء الغالب بالله مُحمَّد بن عليّ مُعاهدةً مع الملكين الكاثوليكيين قضت بِتسليم المدينة، فدخلها القشتاليُّون يوم الإثنين 2 ربيع الأوَّل 897هـ المُوافق فيه 2 كانون الثاني (يناير) 1492م، وبِذلك سقطت غرناطة وسقطت الأندلُس نهائيّاً، وأُسدل الستار على التاريخ السياسي للمُسلمين فيها.,كان هناك انخفاض في عدد السمندل في العقود الأخيرة من القرن العشرين.,False
172,مشكلة أخرى واجهها الألبوم بخصوص الأغنيتين دو إت (Do It) وويت فور يو (Wait For You) حيث تردد أن تمبالاند قام بسرقة الألحان من أغانٍ أخرى الأولى فنلندية والثانية تركية.,اعتقد الإغريق أن هذا الكوكب يتكون من جسمين منفصلين ، أحدهما أبولو والآخر هيرميس ، وأطلقوا عليهما كلاهما.,False
429,وتصحب التغيُّرات الخارجيَّة تغيُّراتٌ داخليَّةٌ أيضًا يتحوَّلُ فرخُ البرمائيّ فيها، باستثناء بعض الأنواع الأرضيَّة من الضفادع والسَّمادر، من التنفُّس بِالخياشيم إلى التنفُّس بِالرئتين.,حصلت الرواية على جائزة كتاب العام لعام 2008 من قبل Weekly Publishers Weekly.,False
376,لذا تعتبر الأسلحة النووية أسلحة دمار شامل ويخضع تصنيعها واستعمالها إلى ضوابط دولية حرجة ويمثل السعي نحو امتلاكها هدفاً تسعى إليه كل الدول.,أ عميد إس أبو سيد مسلمه بين عبد الملك بين مروان بين الحكم بين أبي الاس بين أمية القرشي.,False
67,نُشرت رواية مباريات الجوع لأوّل مرة، في 14 سبتمبر 2008، بطبعة فنّية مُجلَّدة عن طريق مؤسسة إستلاستيك، صمم تيم أوبراين غلافها، ثم صدرت بعدها طبعات بأغلفة ورقية، وطبعات أخرى مسموعة وإلكترونية.,صمم Tim O'Brien غلاف The Hunger Games ، الذي طُبع في غلاف ورقي وإصدارات صوتية وإلكترونية أخرى.,True
482,أبو سعيد مَسْلَمة بن عبد الملك بن مروان بن الحَكَم بن أبي العاص بن أمية الأُموي القُرشي (66 هـ-685 م/7 محرم، 121 هـ-24 ديسمبر، 738 م)، هو أمير أُموي، وقائد عسكري، ووالي، وسياسي ورجل دولة.,بعد مقتل فارس الدين أقطاي وقمع انتفاضات الراغبين في الحكم ، رتب البيت الداخلي لمصر وأصدر عفواً شاملاً عن المماليك الفارين من مصر.,False
29,تُوفيت مَيّ في مُستشفى المُعادي في 17 تشرين الأول 1941م في مَدينة القاهرة عن عمر يُناهز 55 عاماً.,باع الألبوم سبعة ملايين نسخة حول العالم في بداية أغسطس 2007 ، وفاز بالمركز الأول مرتين في مخطط العالم المتحد ، فضلًا عن ترشيحه لـ 5 جوائز.,False
259,ولا يمكن رؤية عطارد في وهج النهار إلا (للراصدين المحترفين) وأثناءالكسوف الكلي للشمس، ووقت عبوره من أمام قرصها؛ الحدث الذي يتكرر 13 مرة كل قرن، وحدث آخر مرة يوم 11 تشرين ثاني/ نوفمبر 2019، وسيحدث المرة المقبلة عام 2032.,يمكن للمراقبين المحترفين فقط رؤية عطارد في النهار وأثناء الكسوف الكلي للشمس ، وكذلك الوقت الذي مر فيه أمام قرصه ، وآخر مرة حدث في 11 نوفمبر 2019.,True
31,تُوفيت مَيّ في مُستشفى المُعادي في 17 تشرين الأول 1941م في مَدينة القاهرة عن عمر يُناهز 55 عاماً.,فضفاض هو الألبوم الموسيقي الثالث لمغنية البوب ​​الكندية نيللي فورتادو.,False
36,مباريات الجوع (بالإنجليزية: The Hunger Games)‏؛ هي رواية ديستوبية للكاتبة الأمريكية سوزان كولنز، صدرت في عام 2008.,صدرت رواية سوزان كولينز The Hunger Games في عام 2008.,True
196,ومع هزيمة الحزب الوطني الصيني المعروف باسم الكوميتانج في الحرب الأهلية أمام قوات الحزب الشيوعي الصيني الجديد انتقلت الحكومة المهزومة إلى تايوان حيث أسست مدينة تايبيه كعاصمة مؤقتة للبلاد، في حين أسس أعضاء الحزب الشيوعي جمهورية الصين الشعبية في البر الصيني حيث موقعها الجغرافي المعروف الآن.,دولة بني نصر هي آخر دولة إسلامية تأسست في الأندلس خلال العام.,False
466,تتكوَّن هذه الطائفة اليوم من ثلاث رُتب: عديمات الأذيال (الضفادع والعلاجيم) وذوات الأذيال (السَّمادر أو السمادل) وعديمات الأرجل.,تتكون الطائفة من ثلاث رتب ، ذيل ، ذيل ، بلا أرجل.,True
205,أما دستورياً، فلم تتنازل جمهورية الصين عن حقها الشرعي في كونها الوريث الحقيقي والممثل الشرعي لجمهورية الصين الزائلة إلا أنها في الواقع لم تهتم كثيراً بهذه القضية، حيث تختلف وجهة النظر السياسية في جمهورية الصين على السيادة الحقيقية للبلاد حيث صرح الرئيسان السابقان للبلاد لي تينج هوي وتشن شوي بيان بأن حكومة جمهورية الصين منفصلة تماماً وهي كيان مستقل سياسياً ولا تمت بأي صلة للحكومة المسيطرة على الجمهورية الشعبية ومن ثم لا يوجد داع لإعلان استقلال البلاد المستقلة بالفعل.,إن جمهورية الصين لها حقها المشروع في أن تكون الوريث الحقيقي والممثل الشرعي لجمهورية الصين المتلاشية ، لكنها لم تولي اهتماما كبيرا لهذه القضية باعتبارها وجهة النظر السياسية في جمهورية الصين.,True
207,في حين أعلن الرئيس ما ينج جيو، الرئيس الحالي لجمهورية الصين، أن بلاده دولة مستقلة ذات سيادة وأحقية في إدارة كلا من تايوان وجمهورية الصين الشعبية.وجمهورية الصين جمهورية ديمقراطية يحكمها نظام نصف رئاسي وقانون انتخابي.,كانت هذه المملكة الصغيرة جديرة بالاستيلاء على تراث الأندلس ، وبفضل حكامها وسياساتهم المرنة ، استمرت لنحو مائتين وخمسين عامًا أخرى كمستودع للحضارة الإسلامية في الأندلس ، ونفذت في نفس الوقت. النضال القديم ضد الممالك المسيحية.,False
166,"واجه ""لووس"" عدد من المشاكل منها أنه في 7 يونيو 2006، قبل طرح الألبوم، تم اختيار كريس مارتن ليضيف صوته إلى أغنية أول غود ثينغز (كوم تو أن إند) حيث غنى وصلات مع نيللي في الأغنية ولكن تم استبعاده بطلب منه وبإشعار من شركة EMI الموسيقية.",يشبه عطارد قمر الأرض في شكله ، حيث يحتوي على العديد من الفوهات الصدمية ، وليس له أقمار طبيعية أو غلاف جوي ، لكن له قلب حديدي على عكس القمر ، مما يؤدي إلى توليد مجال مغناطيسي يساوي 1٪.,False
37,تُسرد أحداث الرواية على لسان بطلتها كاتنيس إيفردين، وهي فتاة في السادسة عشرة من العمر، تعيش في عصر نهاية العالم في المقاطعة الثانية عشرة، في دولة بانيم بأمريكا الشمالية وهي خاضعة لسلطة مركزيّة تسمى الكابيتول، وهي حاضرة مُتقدّمة تقنيًا، استطاعت أن تبسط سيطرتها العسكرية والسياسية على عموم مقاطعات بانيم.,باع الألبوم سبعة ملايين نسخة حول العالم في بداية أغسطس 2007 ، وفاز بالمركز الأول مرتين في مخطط العالم المتحد ، فضلًا عن ترشيحه لخمس جوائز.,False
3,مي زيادة (1886-1941) أديبة وكاتبة عربية وُلدت في الناصرة عام 1886، اسمها الأصلي كان ماري إلياس زيادة، واختارت لنفسها اسم مي فيما بعد.,وأصبحت مقبرة الحسن في كربلاء مقدسا للشيعة مع تكرار الصلوات الخاصة في كل زيارة لقبره.,False
324,وكانت هذه المملكة الصغيرة جديرةً بِأن ترث التركة الأندلُسيَّة، واستمرَّت بِفضل وعي حُكَّامها وسياساتهم المرنة زهاء مائتين وخمسين سنةً أُخرى كمُستودعٍ لِلحضارة الإسلاميَّة في الأندلُس، واضطلعت في الوقت نفسه بِذلك النضال القديم ضدَّ الممالك المسيحيَّة حتَّى لقيت مصرعها في النهاية.,كانت هذه المملكة الصغيرة جديرة بالاستيلاء على تراث الأندلس ، وبفضل حكامها وسياساتهم المرنة ، استمرت لمدة مائتين وخمسين عامًا أخرى كمستودع للحضارة الإسلامية في الأندلس ، وفي نفس الوقت نفذت الكفاح القديم ضد الممالك المسيحية.,True
209,في حين أعلن الرئيس ما ينج جيو، الرئيس الحالي لجمهورية الصين، أن بلاده دولة مستقلة ذات سيادة وأحقية في إدارة كلا من تايوان وجمهورية الصين الشعبية.وجمهورية الصين جمهورية ديمقراطية يحكمها نظام نصف رئاسي وقانون انتخابي.,صرح الرئيس الحالي لجمهورية الصين ، ما ينغ جيو ، أن بلاده دولة مستقلة ذات سيادة ولها الحق في إدارة كل من تايوان وجمهورية الصين الشعبية.,True
417,جميعُ البرمائيَّات المُعاصرة تنتمي إلى طُويئفة ملساء الجلد (باللاتينية: Lissamphibia)، وهي تقطُنُ تشكيلةً واسعةً من الموائل الطبيعيَّة، من البيئات الأرضيَّة والجُحريَّة والشجريَّة والمائيَّة العذبة.,هناك مجموعة متنوعة من الموائل الطبيعية للسلمندر المعاصر ، وهم أعضاء في فئة Lissamphibia.,True
470,"يصلُ عدد أنواع البرمائيَّات المُعاصرة إلى حوالي 8,000 نوعٍ، تُشكِّلُ الضفادع ما نسبته 90% منها.",تشكل الضفادع 90٪ من أنواع البرمائيات الحديثة.,True
238,فيما تستعمل اللغات التي لم تعرف الكوكب باسم محدد الاسم اللاتيني ميركوري (تلفظ ‎[ /ˈmɜrkjəri/]‏) في اللاتينية نسبة لإله التجارة الروماني.,يعتبر كتاب الطبقات الكبير مرجعاً في السيرة النبوية وترجماتها وتاريخها ، حيث تناول مؤلفه السيرة النبوية المطهرة ، وعرض الفتوى في المدينة المنورة ، وجمع القرآن الكريم ، ثم عرضه على المصحف الشريف. الصحابة و,False
55,كما أشيد بحبكة الرواية وشخصياتها المُحكمة.,"كان قرارًا ذكيًا تسمية الألبوم ""فضفاض"" ، حيث ساعد في انتشار الألبوم حول العالم.",False
457,ومع مُرُور الزمن، تقلَّص حجم البرمائيَّات وقلَّ تنوُّعها، حتَّى اقتصرت على طُويئفة ملساء الجلد الباقية إلى اليوم.,بعد مرور الوقت ، انخفض حجم البرمائيات وتناقص تنوعها ، حتى اقتصرت على نطاق البشرة الملساء الذي بقي حتى يومنا هذا.,True
299,"وكان الفلكيون القدماء يعتقدون بأن ""برية هرمس الهرامسة"" (باللاتينية: Solitudo Hermae Trismegisti) تُشكل ميزة أساسية من ميزات الكوكب، حيث قيل بأنها تغطي تقريباً ربع ربعه الجنوبي الشرقي.",البرمائيات هي الحيوانات الوحيدة التي تبدأ حياتها في الماء ثم تغادرها بعد تحولات فيزيائية داخلية وخارجية طويلة حتى يتحول صغارها ، المسماة الضفادع الصغيرة ، من شكل السمكة إلى شكلها البالغ.,False
437,لِلبرمائيَّات شبهٌ ظاهريٌّ بِالعظايا، على أنَّ الأخيرة بِالإضافة إلى الثدييَّات والطُيُور تنتمي إلى الفرع الحيوي المعروف بِالسلويَّات، وهي الكائنات التي تضع صغارًا مُغلَّفةً بِغشاءٍ سلويّ، ولا تحتاج لِبيئةٍ مائيَّة لِلحفاظ على ذُريَّتها.,تأثر كولينز بالأساطير اليونانية والمصارعة الرومانية وتليفزيون الواقع في كتابته The Hunger Games.,False
330,فقد استمرَّت مملكة قشتالة تبتلع البلاد التابعة لِغرناطة حتَّى حاصرها الملكان الكاثوليكيان فرديناند الثاني الأرغوني وإيزابيلَّا الأولى القشتاليَّة في جُمادى الآخرة 896هـ المُوافق فيه نيسان (أبريل) 1491م، وبعد سبعة أشهُرٍ من الحصار دبَّ اليأس في نُفُوس المُسلمين وانتشر الجوع وتفشَّت الأمراض في صُفُوفهم، فأبرم آخر الأُمراء الغالب بالله مُحمَّد بن عليّ مُعاهدةً مع الملكين الكاثوليكيين قضت بِتسليم المدينة، فدخلها القشتاليُّون يوم الإثنين 2 ربيع الأوَّل 897هـ المُوافق فيه 2 كانون الثاني (يناير) 1492م، وبِذلك سقطت غرناطة وسقطت الأندلُس نهائيّاً، وأُسدل الستار على التاريخ السياسي للمُسلمين فيها.,تم غزو مملكة قشتالة من قبل الملكين الكاثوليك فرديناند الثاني من أراغون وإيزابيلا الأولى ملك قشتالة في أبريل 1499 م.,True
70,نُشرت رواية مباريات الجوع لأوّل مرة، في 14 سبتمبر 2008، بطبعة فنّية مُجلَّدة عن طريق مؤسسة إستلاستيك، صمم تيم أوبراين غلافها، ثم صدرت بعدها طبعات بأغلفة ورقية، وطبعات أخرى مسموعة وإلكترونية.,صمم Tim O'Brien غلاف The Hunger Games وتم طباعته في غلاف ورقي وإصدارات صوتية وإلكترونية أخرى.,True
349,790هـ/1388م) الفقيه الأصولي المجتهد.,الاصولي الفقيه الفقيه.,True
0,مي زيادة (1886-1941) أديبة وكاتبة عربية وُلدت في الناصرة عام 1886، اسمها الأصلي كان ماري إلياس زيادة، واختارت لنفسها اسم مي فيما بعد.,بعد مقتل فارس الدين أقطاي وقمع انتفاضات الراغبين في الحكم ، رتب البيت الداخلي لمصر وأصدر عفواً شاملاً عن المماليك الفارين من مصر.,False
306,مَملَكَةُ غِرنَاطَة أو إِمَارَةُ غِرنَاطَة أو الدَّولَةُ النَصرِيَّة أو دَولَةُ بَنِي نَصر هي آخرُ دولةٍ إسلاميَّة قامت في الأندلُس سنة 635هـ المُوافقة لِسنة 1237م على يد والي جيَّان وأرجونة مُحمَّد بن يُوسُف بن مُحمَّد الخزرجي المعروف بابن الأحمر، الذي أصبح أوَّل أُمراء هذه الدولة.,"الاسم العربي لشرفات المراقبة محفور من كلمتي ""أرض"" و ""ماء"" بسبب انتمائهما إلى كلتيهما.",False
155,"يُعد الألبوم واحد من أبرز أعمال عاميّ 2006 و2007 حيث بيع منه مع بداية أغسطس 2007 سبعة ملايين نسخة حول العالم وحصل على المركز الأول مرتين في قائمة ""الرسم البياني المتحد"" العالمية (بالإنجليزية: United World Chart)‏ وحاز الألبوم على جوائز عديدة لدرجة أن نيللي حصلت على 5 جوائز في حفل واحد وهو حفل جونو أووردز  إضافة إلى حصولها على جائزة أفضل مطربة في حفل جوائز برتس البريطانية ووورلد ميوزك أووردز، كما رشحت أغنيتها بروميسكيوس لجائزة غرامي.",باع الألبوم سبعة ملايين نسخة حول العالم في بداية أغسطس 2007 ، وفاز بالمركز الأول مرتين في مخطط العالم المتحد ، بالإضافة إلى حصوله على العديد من الجوائز.,True
