,original,paraphrase,similar
177,تايوان (بالصينية التقليدية: 臺灣؛ وبالصينية المبسطة:台湾) كما تُكتب أحيانًا تيوان (بفتح التاء وسكون الياء)، المعروفة رسميًا باسم جمهورية الصين (بالصينية التقليدية: 中華民國؛ وبالصينية المبسطة: 中华民国) وباسم تايبيه الصينية في اللجنة الأولمبية الدولية ومنظمة التجارة العالمية، هي دولة واقعة في شرق آسيا تشكل جزيرة تايوان 99% من أراضيها، كانت قبل عام 1949 جزء لا يتجزأ من دولة الصين الكبرى، واعتبرت عضوا مؤسساً لهيئة الأمم المتحدة وأحد الأعضاء الخمس الدائمين في مجلس الأمن حتى تم تغيير الكيان السياسي وصاحب حق العضوية عام 1971 لحق جمهورية الصين الشعبية بناءً على القرار رقم 2758 والصادر عن جمعية الأمم المتحدة باعتبار جمهورية الصين الشعبية هي الممثل الشرعي الوحيد للكيان السياسي السابق والذي عرف بجمهورية الصين الموحدة قبل نشوب الحرب الأهلية عام 1949 والتي ترتب عنها سيطرة الشيوعيين على الصين المعروفة الآن باسم جمهورية الصين الشعبية في حين سيطر القوميون على جزيرة تايوان.,الشكل الأسطوري لصولجان إله التجارة اليوناني هو ما ألهم الرمز الفلكي لعطارد.,False
337,وقد حقَّقت الاكتفاء الذاتي بشهادة الرحَّالة ابن بطوطة (04-1377م) الذي وصفها بالمملكة القويَّة رُغم المُناوشات المُستمرَّة مع الممالك المسيحيَّة المُجاورة، وبِالأخص قشتالة.,حققت الاكتفاء الذاتي بفضل شهادة الرحالة ابن بطوطة الذي وصفها بأنها مملكة قوية رغم الصراعات المستمرة مع الممالك المسيحية المجاورة.,True
423,والبرمائيَّات هي الحيوانات الوحيدة التي تبدأ حياتها في الماء ثُمَّ تُغادرُهُ بعد تحوُّلاتٍ جُسمانيَّةٍ داخليَّةٍ وخارجيَّة، فتتحوَّلُ صغارها، المُسمَّاة شراغيف (مُفردُها شُرغُوف)، من شكل السمكة إلى شكلها البالغ.بعد أن تنقف البُيُوض وتخرجُ الشراغيف، تمُرُّ بِسلسلة تغييراتٍ جُسمانيَّة، فهي تولدُ بِذنبٍ طويلٍ يُعينُها على السباحة وخياشيم جانبيَّةٍ تتنفَّسُ بها كالسَّمك، فتتغطَّى خياشمها بِغشاءٍ جلديٍّ وتختفي من ظاهر الجسم، وتظهر بوادرُ الرِّجلين الخلفيَّتين في حالة الضفادع والسَّمادر، وتتوالى التغيُّرات تدريجيًّا فتظهر الرِّجلان الأماميَّتان، ثُمَّ يتقاصر الذنب بِبُطءٍ حتَّى يختفي عند الضفادع ويستمرُّ عند السَّمادر.,حظيت الرواية بالكثير من الثناء.,False
171,لم تحذف الأغنية من الألبوم بل لا زالت موجودة بصوت نيللي فرتادو وحدها، ولكن تم تسريب النسخة القديمة من الأغنية التي ظهر بها صوت كريس مارتن في شبكة الإنترنت، يذكر أن كريس هو فنان بريطاني.,يتكون الزئبق من 70٪ معادن و 30٪ سيليكات ، وكثافته أقل من كثافة الأرض ، لكنه ثاني أكبر كثافة في المجموعة الشمسية.,False
14,بدأت ميّ زيادة أول مراحلها التّعليميّة في مدارس النّاصرة الابتدائيّة ثمّ تابعت دراستها الثانويّة في دير الرّاهبات في مَنطقة عينطورة، ثم استكملت دراستها في كلية الآداب بالقاهرة.,فضفاض هو الألبوم الثالث لمغنية البوب ​​الكندية نيللي فورتادو.,False
367,السلاح النووي هو سلاح تدمير فتاك يستخدم عمليات التفاعل النووي، يعتمد في قوته التدميرية على عملية الانشطار النووي أو الاندماج النووي؛ ونتيجة لهذه العملية تكون قوة انفجار قنبلة نووية صغيرة أكبر بكثير من قوة انفجار أضخم القنابل التقليدية، حيث أن بإمكان قنبلة نووية واحدة تدمير أو إلحاق أضرار فادحة بمدينة بكاملها.,ث عميد إس أبو سيد مسلمه بين عبد الملك بين مروان بين الحكم بين أبي الاس بين عميد.,False
197,في حين أصبحت جزر تايوان والبسكادورز وملحقاتهما وجزر كينمن وماتسو وبعض الجزر الصغرى الأخرى امتداداً لجمهورية الصين الزائلة بالرغم من أنها حصلت على اعتراف العديد من الدول الغربية والولايات المتحدة بها كالوريث الشرعي لجمهورية الصين مع بدايات الحرب الباردة.,اعترفت العديد من الدول الغربية والولايات المتحدة بجزر تايوان ، وجزر بيسكادور وملحقاتها ، وجزر كينمن وماتسو ، وبعض الجزر الصغيرة الأخرى ، على أنها الوريث الشرعي لجمهورية الصين.,True
35,مباريات الجوع (بالإنجليزية: The Hunger Games)‏؛ هي رواية ديستوبية للكاتبة الأمريكية سوزان كولنز، صدرت في عام 2008.,فضفاض هو الألبوم الموسيقي الثالث لمغنية البوب ​​الكندية نيللي فورتادو.,False
163,"واجه ""لووس"" عدد من المشاكل منها أنه في 7 يونيو 2006، قبل طرح الألبوم، تم اختيار كريس مارتن ليضيف صوته إلى أغنية أول غود ثينغز (كوم تو أن إند) حيث غنى وصلات مع نيللي في الأغنية ولكن تم استبعاده بطلب منه وبإشعار من شركة EMI الموسيقية.",يستخدم العلماء كثافة عطارد لتحديد البنية الداخلية للكوكب الصغير الذي يقولون إنه مصنوع في الغالب من الحديد.,False
263,المعلومات المتوفرة حول عطارد قليلة نسبياً إذ أن التلسكوبات الأرضية لم تكشف سوى الأجزاء الهلالية من سطح عطارد.,نظرًا لأن التلسكوبات الأرضية لا تكشف إلا الأجزاء الهلالية من سطح عطارد ، فهناك القليل جدًا من المعلومات المتاحة.,True
322,وكانت هذه المملكة الصغيرة جديرةً بِأن ترث التركة الأندلُسيَّة، واستمرَّت بِفضل وعي حُكَّامها وسياساتهم المرنة زهاء مائتين وخمسين سنةً أُخرى كمُستودعٍ لِلحضارة الإسلاميَّة في الأندلُس، واضطلعت في الوقت نفسه بِذلك النضال القديم ضدَّ الممالك المسيحيَّة حتَّى لقيت مصرعها في النهاية.,البرمائيات لها تشابه واضح مع السحالي ، لكن هذه الأخيرة من الثدييات والطيور ولا تحتاج إلى بيئة مائية للحفاظ على نسلها.,False
143,تم إنتاج الألبوم بواسطة شركتي جيفن (بالإنجليزية: Geffen)‏ وموسلي ميوزك (بالإنجليزية: Mosley Music)‏ لصاحبها تمبالاند في تعاونها الأول مع هاتين الشركتين بعد إفلاس شركة دريم ووركس.,نظرًا لأن التلسكوبات الأرضية لا تكشف إلا الأجزاء الهلالية من سطح عطارد ، فهناك القليل جدًا من المعلومات المتاحة.,False
462,تتكوَّن هذه الطائفة اليوم من ثلاث رُتب: عديمات الأذيال (الضفادع والعلاجيم) وذوات الأذيال (السَّمادر أو السمادل) وعديمات الأرجل.,صدرت الرواية الأولى في سلسلة ألعاب الجوع ، Two Flames ، في عام 2009 ، وتبعها Mock Bird في عام 2010.,False
195,ومع هزيمة الحزب الوطني الصيني المعروف باسم الكوميتانج في الحرب الأهلية أمام قوات الحزب الشيوعي الصيني الجديد انتقلت الحكومة المهزومة إلى تايوان حيث أسست مدينة تايبيه كعاصمة مؤقتة للبلاد، في حين أسس أعضاء الحزب الشيوعي جمهورية الصين الشعبية في البر الصيني حيث موقعها الجغرافي المعروف الآن.,هُزم الحزب الوطني الصيني في الحرب الأهلية وانتقلت الحكومة المهزومة إلى تايوان حيث أسست جمهورية الصين الشعبية.,True
440,لِلبرمائيَّات شبهٌ ظاهريٌّ بِالعظايا، على أنَّ الأخيرة بِالإضافة إلى الثدييَّات والطُيُور تنتمي إلى الفرع الحيوي المعروف بِالسلويَّات، وهي الكائنات التي تضع صغارًا مُغلَّفةً بِغشاءٍ سلويّ، ولا تحتاج لِبيئةٍ مائيَّة لِلحفاظ على ذُريَّتها.,البرمائيات لها تشابه واضح مع السحالي ، لكن الثدييات والطيور تنتمي أيضًا إلى الفرع البيولوجي المعروف باسم amniotes ، وهي كائنات تعيش صغارًا مغطاة بغشاء يحيط بالجنين ولا تحتاج إلى بيئة مائية للحفاظ على نسلها.,True
296,يُشتق الرمز الفلكي لعطارد من شكل الصولجان الأسطوري لإله التجارة الإغريقي هرمس.يُعتبر عطارد الكوكب السائد في فلكيّ برج الجوزاء وبرج العذراء وفقًا لعلم التنجيم، حيث يُقال أن تأثيره الفلكي يكون في أوجه عندما يمر ضمن هذه الكوكبات، مما يؤثر على حظوظ الناس المولودين خلال هذا الزمن (حسب رأيهم).,يُعتقد أن الشكل الأسطوري لصولجان إله التجارة اليوناني قد ألهم الرمز الفلكي لعطارد.,True
155,"يُعد الألبوم واحد من أبرز أعمال عاميّ 2006 و2007 حيث بيع منه مع بداية أغسطس 2007 سبعة ملايين نسخة حول العالم وحصل على المركز الأول مرتين في قائمة ""الرسم البياني المتحد"" العالمية (بالإنجليزية: United World Chart)‏ وحاز الألبوم على جوائز عديدة لدرجة أن نيللي حصلت على 5 جوائز في حفل واحد وهو حفل جونو أووردز  إضافة إلى حصولها على جائزة أفضل مطربة في حفل جوائز برتس البريطانية ووورلد ميوزك أووردز، كما رشحت أغنيتها بروميسكيوس لجائزة غرامي.",يمكن للمراقبين المحترفين فقط رؤية عطارد في النهار وأثناء الكسوف الكلي للشمس ، وكانت آخر مرة حدث فيها في نوفمبر من عام 2019.,False
325,وكانت هذه المملكة الصغيرة جديرةً بِأن ترث التركة الأندلُسيَّة، واستمرَّت بِفضل وعي حُكَّامها وسياساتهم المرنة زهاء مائتين وخمسين سنةً أُخرى كمُستودعٍ لِلحضارة الإسلاميَّة في الأندلُس، واضطلعت في الوقت نفسه بِذلك النضال القديم ضدَّ الممالك المسيحيَّة حتَّى لقيت مصرعها في النهاية.,كانت هذه المملكة الصغيرة جديرة بالاستيلاء على تراث الأندلس ، وبفضل حكامها وسياساتهم المرنة ، استمرت نحو مائتين وخمسين عامًا أخرى كمستودع للحضارة الإسلامية في الأندلس.,True
361,يعد كتاب الطبقات الكبير مرجعًا في السيرة النبوية والتراجم والتواريخ، حيث تناول فيه مصنفه السيرة النبوية المطهرة، عارضًا لمن كان يفتي بالمدينة المنورة، ولجمع القرآن الكريم، ثم قدم تراجم للصحابة ومَن بعدهم من التابعين وبعض الفقهاء والعلماء.,تتكون غالبية أنواع البرمائيات الحديثة من الضفادع.,False
243,يبلغ قطره حوالي 4880 كلم وكتلته 0.055 من كتلة الأرض ويتم دورته حول الشمس خلال 87.969 يوم.,يبلغ كتلتها 0.055 أرضًا ويبلغ قطرها 4880 كم.,True
90,وفي عام 2012، أخرج غاري روس فيلمًا مقتبسًا من الرواية حمل الاسم نفسه، وشاركت كولِنز بنفسها في كتابته وإنتاجه.,أخرج جاري روس وشارك كولينز في كتابة وإنتاج فيلم مقتبس عن الرواية التي تحمل الاسم نفسه.,True
161,"سمي الألبوم ""Loose"" الذي يعني بالعربية ""حرة"" بشكل عفوي أثناء عملية تسجيل وإعداد الألبوم، ويعتبر قرار تسميته بهذا الاسم قراراً ذكياً، فقد ساعد العنوان على انتشار الألبوم حول العالم.","ساعد عنوان الألبوم في انتشاره حول العالم ، لذلك كان قرار تسميته ""فضفاض"" قرارًا ذكيًا.",True
145,تم إنتاج الألبوم بواسطة شركتي جيفن (بالإنجليزية: Geffen)‏ وموسلي ميوزك (بالإنجليزية: Mosley Music)‏ لصاحبها تمبالاند في تعاونها الأول مع هاتين الشركتين بعد إفلاس شركة دريم ووركس.,يمتلك عطارد أعلى قيمة للشذوذ بين جميع الكواكب في النظام الشمسي ، ولديه أصغر ميل بين هذه الكواكب ، ويكمل ثلاث دورات حول محوره لكل دورانين.,False
360,يعد كتاب الطبقات الكبير مرجعًا في السيرة النبوية والتراجم والتواريخ، حيث تناول فيه مصنفه السيرة النبوية المطهرة، عارضًا لمن كان يفتي بالمدينة المنورة، ولجمع القرآن الكريم، ثم قدم تراجم للصحابة ومَن بعدهم من التابعين وبعض الفقهاء والعلماء.,وتنقسم هذه الطائفة إلى ثلاث رتب: الذيل ، والذيل ، والسيقان.,False
151,صدر ألبوم لووس في معظم أنحاء العالم بتاريخ 20 يونيو 2006.,تم إصدار الألبوم في معظم أنحاء العالم.,True
221,وجمهورية الصين واحدة من النمور الآسيوية الأربعة ويحتل اقتصادها المركز السادس والعشرين على مستوى العالم.,تحتل جمهورية الصين المرتبة 26 في العالم من حيث الاقتصاد.,True
107,"معركة كربلاء وتسمى أيضاً واقعة الطف هي معركة وقعت على ثلاثة أيام وختمت في 10 محرم سنة 61 للهجرة والذي يوافق 12 أكتوبر 680م، وكانت بين الحسين بن علي بن أبي طالب ابن بنت النبي محمد، الذي أصبح المسلمون يطلقون عليه لقب ""سيد الشهداء"" بعد انتهاء المعركة، ومعه أهل بيته وأصحابه، وجيش تابع ليزيد بن معاوية.",دارت معركة كربلاء ، المعروفة أيضًا باسم حادثة طاف ، على مدى ثلاثة أيام واختتمت في 12 أكتوبر 680 م.,True
289,"كان علماء الفلك الإغريق يعتقدون أن هذا الكوكب عبارة عن جرمين منفصلين، وذلك قبل القرن الرابع قبل الميلاد، وأطلقوا على أحد هذين الجرمين تسمية ""أبولو""، واعتقدوا أنه لا يظهر للعيان إلا عند الشروق، وأطلقوا على الآخر تسمية ""هرمس""، واعتقدوا أنه لا يمكن رؤيته إلا عند الغروب.","الاسم العربي للبرمائيات محفور من كلمتي ""الأرض"" و ""الماء"" بسبب انتمائهما إلى كل منهما.",False
459,ومع مُرُور الزمن، تقلَّص حجم البرمائيَّات وقلَّ تنوُّعها، حتَّى اقتصرت على طُويئفة ملساء الجلد الباقية إلى اليوم.,تعتبر معركة عين جالوت من أهم المعارك في التاريخ الإسلامي.,False
115,"تعدّ واقعة الطف من أكثر المعارك جدلاً في التاريخ الإسلامي فقد كان لنتائج وتفاصيل المعركة آثار سياسية ونفسية وعقائدية لا تزال موضع جدل إلى الفترة المعاصرة، حيث تعدّ هذه المعركة أبرز حادثة من بين سلسلة من الوقائع التي كان لها دور محوري في صياغة طبيعة العلاقة بين السنة والشيعة عبر التاريخ وأصبحت معركة كربلاء وتفاصيلها الدقيقة رمزا للشيعة ومن أهم مرتكزاتهم الثقافية وأصبح يوم 10 محرم أو يوم عاشوراء، يوم وقوع المعركة، رمزاً من قبل الشيعة ""لثورة المظلوم على الظالم ويوم انتصار الدم على السيف"".رغم قلة أهمية هذه المعركة من الناحية العسكرية حيث اعتبرها البعض محاولة تمرّد فاشلة قام بها الحسين إلا أن هذه المعركة تركت آثاراً سياسية وفكرية ودينية هامة.",يحتل اقتصاد جمهورية الصين المرتبة 26 في العالم.,False
398,بعد الهجوم النووي على هيروشيما وناجازاكي وحتى وقتنا الحاضر؛ وقع ما يقارب 2000 انفجاراً نووياً كانت بمجملها انفجارات تجريبية واختبارات قامت بها الدول الثمانية التي أعلنت عن امتلاكها لأسلحة نووية وهي الولايات المتحدة والاتحاد السوفيتي (روسيا حالياً) وفرنسا والمملكة المتحدة والصين وباكستان و الهند و كوريا الشمالية.,نفذت الولايات المتحدة والاتحاد السوفيتي وفرنسا والمملكة المتحدة والصين تفجيرات تجريبية للأسلحة النووية بعد الهجوم على ناغازاكي.,True
74,ولقد قُدّرت مبيعات الطبعة الأولى من الرواية بحوالي مائتي ألف نسخة، وبحلول فبراير من عام 2010، وصلت مبيعات الرواية إلى ثمانمائة ألف نسخة.,تم الاعتراف بجزر تايوان ، و Piscadors وملحقاتها ، وجزر Kinmen و Matsu ، وبعض الجزر الصغيرة الأخرى باعتبارها الوريث الشرعي لجمهورية الصين من قبل العديد من الدول الغربية والولايات المتحدة.,False
319,اجتمعت تحت ظلال هذه الدولة أشلاء الأندلُس المنهارة والتي انكمشت أطرافها فيما وراء نهر الوادي الكبير جنوباً، وشغلت شرقاً رُقعةً مُتواضعةً من جيَّان وبياسة وإستجَّة حتَّى البحر المُتوسِّط، ومن ألمرية وإلبيرة غرباً حتَّى مصب الوادي الكبير.,انهارت أطلال الأندلس تحت ظل هذه الدولة التي ضمت منطقة من الشرق إلى البحر الأبيض المتوسط ​​ومن الميرة والبيرة جنوبا.,True
15,بدأت ميّ زيادة أول مراحلها التّعليميّة في مدارس النّاصرة الابتدائيّة ثمّ تابعت دراستها الثانويّة في دير الرّاهبات في مَنطقة عينطورة، ثم استكملت دراستها في كلية الآداب بالقاهرة.,بعد أن أنهت تعليمها الثانوي في دير الراهبات بمنطقة عينطورة ، بدأت مي دراستها في كلية الآداب بالقاهرة.,True
426,والبرمائيَّات هي الحيوانات الوحيدة التي تبدأ حياتها في الماء ثُمَّ تُغادرُهُ بعد تحوُّلاتٍ جُسمانيَّةٍ داخليَّةٍ وخارجيَّة، فتتحوَّلُ صغارها، المُسمَّاة شراغيف (مُفردُها شُرغُوف)، من شكل السمكة إلى شكلها البالغ.بعد أن تنقف البُيُوض وتخرجُ الشراغيف، تمُرُّ بِسلسلة تغييراتٍ جُسمانيَّة، فهي تولدُ بِذنبٍ طويلٍ يُعينُها على السباحة وخياشيم جانبيَّةٍ تتنفَّسُ بها كالسَّمك، فتتغطَّى خياشمها بِغشاءٍ جلديٍّ وتختفي من ظاهر الجسم، وتظهر بوادرُ الرِّجلين الخلفيَّتين في حالة الضفادع والسَّمادر، وتتوالى التغيُّرات تدريجيًّا فتظهر الرِّجلان الأماميَّتان، ثُمَّ يتقاصر الذنب بِبُطءٍ حتَّى يختفي عند الضفادع ويستمرُّ عند السَّمادر.,البرمائيات هي الحيوانات الوحيدة التي تبدأ حياتها في الماء ثم تتركها بعد تحول فيزيائي داخلي وخارجي طويل ، لذلك يتحول صغارها ، الذين يطلق عليهم الضفادع الصغيرة ، من شكل السمكة إلى شكلها البالغ.,True
371,السلاح النووي هو سلاح تدمير فتاك يستخدم عمليات التفاعل النووي، يعتمد في قوته التدميرية على عملية الانشطار النووي أو الاندماج النووي؛ ونتيجة لهذه العملية تكون قوة انفجار قنبلة نووية صغيرة أكبر بكثير من قوة انفجار أضخم القنابل التقليدية، حيث أن بإمكان قنبلة نووية واحدة تدمير أو إلحاق أضرار فادحة بمدينة بكاملها.,"النوع الأخير لا يصبح قزمًا أمام بعض الأنواع المنقرضة ، مثل التمساح الجبلي الذي يبلغ طوله 9 أمتار ""Prionosux"" ، والذي عاش في منتصف العصر البرمي ، على الأراضي التي تتكون منها البرازيل اليوم.",False
437,لِلبرمائيَّات شبهٌ ظاهريٌّ بِالعظايا، على أنَّ الأخيرة بِالإضافة إلى الثدييَّات والطُيُور تنتمي إلى الفرع الحيوي المعروف بِالسلويَّات، وهي الكائنات التي تضع صغارًا مُغلَّفةً بِغشاءٍ سلويّ، ولا تحتاج لِبيئةٍ مائيَّة لِلحفاظ على ذُريَّتها.,البرمائيات لها تشابه واضح مع السحالي ، لكن هذه الأخيرة من الثدييات والطيور ولا تحتاج إلى بيئة مائية للحفاظ على نسلها.,True
