,original,paraphrase,similar
320,اجتمعت تحت ظلال هذه الدولة أشلاء الأندلُس المنهارة والتي انكمشت أطرافها فيما وراء نهر الوادي الكبير جنوباً، وشغلت شرقاً رُقعةً مُتواضعةً من جيَّان وبياسة وإستجَّة حتَّى البحر المُتوسِّط، ومن ألمرية وإلبيرة غرباً حتَّى مصب الوادي الكبير.,انهارت أطلال الأندلس تحت ظل هذه الدولة التي ضمت منطقة من الشرق إلى البحر الأبيض المتوسط ​​ومن الميرا إلى الغرب.,True
393,اُستُعمِلَت القنبلة الذرية مرتين في تاريخ الحروب؛ وكانتا كلتاهما أثناء الحرب العالمية الثانية عندما قامت الولايات المتحدة بإسقاط قنبلتين ذريتين على مدينتي هيروشيما وناجازاكي في اليابان في أواخر أيام الحرب، أوقعت الهجمة النووية على اليابان أكثر من 000’120 شخص معظمهم من المدنيين وذلك في نفس اللحظة، كما أدت إلى مقتل ما يزيد عن ضعفي هذا الرقم في السنوات اللاحقة نتيجة التسمم الإشعاعي أو ما يعرف بمتلازمة الإشعاع الحادة، انتقدت الكثير من الدول الهجوم النووي على هيروشيما وناجازاكي إلا أن الولايات المتحدة زعمت أنها أفضل طريقة لتجنب أعداد أكبر من القتلى إن استمرت الحرب العالمية الثانية فترة أطول.,ألقت الولايات المتحدة قنابل ذرية على اليابان خلال الحرب العالمية الثانية ، مما أسفر عن مقتل أكثر من 100000 شخص.,True
300,"وكان الفلكيون القدماء يعتقدون بأن ""برية هرمس الهرامسة"" (باللاتينية: Solitudo Hermae Trismegisti) تُشكل ميزة أساسية من ميزات الكوكب، حيث قيل بأنها تغطي تقريباً ربع ربعه الجنوبي الشرقي.",اتهم عدد من الحكومات إيران بامتلاكها قدرة نووية.,False
476,أصغر البرمائيَّات (والفقاريَّات عُمومًا) هو الضُفيدع الأماوي (باللاتينية: Paedophryne amauensis) من غينيا الجديدة، البالغ طوله 7.7 مليمترات (0.30 إنشًا)، أمَّا أضخمها فهو السمندر الصيني الجنوبي العملاق (باللاتينية: Andrias sligoi) البالغ طوله 1.8 أمتار.,تعتبر معركة عين جالوت من أهم المعارك في التاريخ الإسلامي.,False
157,"سمي الألبوم ""Loose"" الذي يعني بالعربية ""حرة"" بشكل عفوي أثناء عملية تسجيل وإعداد الألبوم، ويعتبر قرار تسميته بهذا الاسم قراراً ذكياً، فقد ساعد العنوان على انتشار الألبوم حول العالم.",يشبه عطارد قمر الأرض في شكله ، حيث يحتوي على العديد من الفوهات الصدمية ، ومناطق بسيطة ملساء ، وليس له أقمار طبيعية أو غلاف جوي ، ولكنه يحتوي على قلب حديدي على عكس القمر ، مما يؤدي إلى توليد مغناطيسي. الحقل يساوي 1٪ من,False
461,ومع مُرُور الزمن، تقلَّص حجم البرمائيَّات وقلَّ تنوُّعها، حتَّى اقتصرت على طُويئفة ملساء الجلد الباقية إلى اليوم.,حتى تم حصرهم في النطاق ذي البشرة الناعمة ، انخفض حجم السمندل وانخفض تنوعهم.,True
249,لعطارد أعلى قيمة للشذوذ المداري من بين جميع كواكب المجموعة الشمسية، ولديه أصغر ميل محوري من بين هذه الكواكب وهو يكمل ثلاث دورات حول محوره لكل دورتين مداريتين.,يحتوي عطارد على أعلى قيمة للشذوذ بين جميع الكواكب في النظام الشمسي ولديه أصغر ميل بين الكواكب.,True
370,السلاح النووي هو سلاح تدمير فتاك يستخدم عمليات التفاعل النووي، يعتمد في قوته التدميرية على عملية الانشطار النووي أو الاندماج النووي؛ ونتيجة لهذه العملية تكون قوة انفجار قنبلة نووية صغيرة أكبر بكثير من قوة انفجار أضخم القنابل التقليدية، حيث أن بإمكان قنبلة نووية واحدة تدمير أو إلحاق أضرار فادحة بمدينة بكاملها.,أكبر سمندل في العالم هو السمندل الصيني الجنوبي العملاق (لاتيني: Andrias sligoi) ، وأصغره هو الضفدع الأمومي من نيوزيلندا.,False
3,مي زيادة (1886-1941) أديبة وكاتبة عربية وُلدت في الناصرة عام 1886، اسمها الأصلي كان ماري إلياس زيادة، واختارت لنفسها اسم مي فيما بعد.,كاتبة وكاتبة عربية من مواليد 1886 ، اختارت اسم مي لنفسها بعد تغيير اسمها.,True
57,اعتمدت كولِنز في كتابة مباريات الجوع على مضامين من الميثولوجيا الإغريقية، المصارعة الرومانية وتلفزيون الواقع.,يقال إن أول أغنيتين في الألبوم ، Do It و Wait For You ، قد سُرقت من أغانٍ أخرى.,False
161,"سمي الألبوم ""Loose"" الذي يعني بالعربية ""حرة"" بشكل عفوي أثناء عملية تسجيل وإعداد الألبوم، ويعتبر قرار تسميته بهذا الاسم قراراً ذكياً، فقد ساعد العنوان على انتشار الألبوم حول العالم.",أول مسبار فضائي يزور عطارد كان Mariner 10 ، الذي أسقط خرائط 45٪ من سطح الكوكب من 1974 إلى 1975 ، والثاني كان مسبار Messinger الذي أضاف 30٪ من الخرائط إلى الكوكب عندما مر بالقرب منه. في 14 يناير 2008.,False
363,ومن منهج المصنف في الكتاب أنه يذكر اسم العلم المترجم له، ونسبه، وإسلامه، ومآثره، وما ورد في فضله في ترجمة مطولة، وقد بلغ عدد الأعلام المترجم لهم 4725 علمًا، ويُعد هذا الكتاب من أقدم الكتب التي وصلت إلينا من كتب التواريخ الجامعة لرواة السنة النبوية من ثقات وضعفاء، وهو مرتب على الطبقات، وقد تكلم على الرواة جرحًا وتعديلًا.,وقد ورد في الكتاب اسم العلم المترجم له ونسبه وإسلامه ومآثره وما ورد في مزاياه في ترجمة مطولة.,True
257,ولا يمكن رؤية عطارد في وهج النهار إلا (للراصدين المحترفين) وأثناءالكسوف الكلي للشمس، ووقت عبوره من أمام قرصها؛ الحدث الذي يتكرر 13 مرة كل قرن، وحدث آخر مرة يوم 11 تشرين ثاني/ نوفمبر 2019، وسيحدث المرة المقبلة عام 2032.,يمكن للمراقبين المحترفين فقط رؤية عطارد في النهار وأثناء الكسوف الكلي للشمس ، وكذلك الوقت الذي مر فيه أمام قرصه ، وآخر مرة حدث في 11 نوفمبر 2019.,True
286,يلجأ العلماء إلى كثافة عطارد لتحديد بنيته الداخلية، حيث يقولون أنه بسبب حجم الكوكب الصغير وعدم انضغاط مكوناته الداخلية، فإنه لا بد من أن تكون نواته ضخمة الحجم ومكونة بمعظمها من الحديد.يرجع تاريخ رصد عطارد إلى الألفية الأولى قبل الميلاد.,تُستخدم كثافة عطارد لتحديد الهيكل الداخلي للكوكب الصغير ، والذي يتكون في الغالب من الحديد.,True
427,وتصحب التغيُّرات الخارجيَّة تغيُّراتٌ داخليَّةٌ أيضًا يتحوَّلُ فرخُ البرمائيّ فيها، باستثناء بعض الأنواع الأرضيَّة من الضفادع والسَّمادر، من التنفُّس بِالخياشيم إلى التنفُّس بِالرئتين.,نالت الرواية المديح.,False
106,فبدأ بالتحضير لمواجهة التتار، فقام بترتيب البيت الداخلي لمصر وقمع ثورات الطامعين بالحكم، ثم أصدر عفواً عاماً عن المماليك الهاربين من مصر بعد مقتل فارس الدين أقطاي بمن فيهم بيبرس، ثم طلب من العز بن عبد السلام إصدار فتوى تُشرع له جمع الضرائب على سكان مصر بعد أن واجهته أزمة اقتصادية عجز من خلالها عن تجهيز الجيش، وكان له ما أراد وأصدر العز بن عبد السلام فتوى تجيز جمع الضرائب بشروطٍ خاصة ومحددة، ما إن انتهى قطز من تجهيز الجيش حتى سار به من منطقة الصالحية شرق مصر حتى وصل إلى سهل عين جالوت الذي يقع تقريباً بين مدينة بيسان شمالاً ومدينة نابلس جنوباً في فلسطين، وفيها تواجه الجيشان الإسلامي والمغولي، وكانت الغلبة للمسلمين، واستطاع الآلاف من المغول الهرب من المعركة واتجهوا قرب بيسان، وعندها وقعت المعركة الحاسمة وانتصر المسلمون انتصاراً عظيماً، وأُبيد جيش المغول بأكمله.كان لمعركة عين جالوت أثراً عظيماً في تغيير موازين القوة بين القوى العظمى المتصارعة في منطقة الشام، فقد تسببت خسارة المغول في المعركة من تحجيم قوتهم، فلم يستطع القائد المغولي هولاكو الذي كان مستقراً في تبريز من التفكير بإعادة احتلال الشام مرةً أخرى، وكان أقصى ما فعله رداً على هزيمة قائده كتبغا هو إرسال حملة انتقامية أغارت على حلب.,يعتبر رئيس الدولة هو رئيس الحكومة وللمجلس التشريعي سلطة إصدار القوانين في البلاد.,False
111,"معركة كربلاء وتسمى أيضاً واقعة الطف هي معركة وقعت على ثلاثة أيام وختمت في 10 محرم سنة 61 للهجرة والذي يوافق 12 أكتوبر 680م، وكانت بين الحسين بن علي بن أبي طالب ابن بنت النبي محمد، الذي أصبح المسلمون يطلقون عليه لقب ""سيد الشهداء"" بعد انتهاء المعركة، ومعه أهل بيته وأصحابه، وجيش تابع ليزيد بن معاوية.",دارت معركة كربلاء ، المعروفة أيضًا باسم حادثة طاف ، على مدى ثلاثة أيام واختتمت في 12 أكتوبر 680 م.,True
238,فيما تستعمل اللغات التي لم تعرف الكوكب باسم محدد الاسم اللاتيني ميركوري (تلفظ ‎[ /ˈmɜrkjəri/]‏) في اللاتينية نسبة لإله التجارة الروماني.,الاسم اللاتيني عطارد هو إشارة إلى إله التجارة الروماني.,True
245,يبلغ قطره حوالي 4880 كلم وكتلته 0.055 من كتلة الأرض ويتم دورته حول الشمس خلال 87.969 يوم.,الفقيه الأصولي حسن النية.,False
313,وهكذا أخذت صُورة الوضع السياسي لِلدولة الإسلاميَّة الجديدة في الأندلُس تتوضَّح تحت حُكم مُحمَّدِ بن الأحمر، الذي اتخذ غرناطة عاصمةً لهُ بدلاً من جيَّان التي كانت واقعةً تحت تهديد النصارى المُستمر.,تستخدم البرمائيات جلودها كنظام تنفسي ثانوي ، وتعتمد بعض الأنواع على التنفس من جلودها بسبب نقص الرئتين.,False
467,"يصلُ عدد أنواع البرمائيَّات المُعاصرة إلى حوالي 8,000 نوعٍ، تُشكِّلُ الضفادع ما نسبته 90% منها.",أخرج جاري روس وشارك كولينز في كتابة وإنتاج فيلم مقتبس عن الرواية التي تحمل الاسم نفسه.,False
219,وجمهورية الصين واحدة من النمور الآسيوية الأربعة ويحتل اقتصادها المركز السادس والعشرين على مستوى العالم.,يعد قصر الحمراء من أروع المعالم المعمارية في العالم ومن أبرز المعالم الثقافية في هذه المملكة.,False
188,ومع نهاية الحرب العالمية الثانية واستسلام اليابان قامت الصين بضم مجموعة جزر تايوان وبسكادورز إلى حكمها.,بعد انهيار الدولة التوحيدية في المغرب والأندلس ، سقطت المدن الأندلسية الكبرى في أيدي المسيحيين ، وكان الإسلام والمسلمون في خطر الزوال ، رد محمد بن الأحمر على الفتوحات المسيحية بإنشاء مملكة غرناطة. .,False
240,فيما تستعمل اللغات التي لم تعرف الكوكب باسم محدد الاسم اللاتيني ميركوري (تلفظ ‎[ /ˈmɜrkjəri/]‏) في اللاتينية نسبة لإله التجارة الروماني.,يعد قصر الحمراء من أروع المعالم المعمارية في العالم ، وهو من أبرز المعالم الثقافية في هذه المملكة.,False
474,أصغر البرمائيَّات (والفقاريَّات عُمومًا) هو الضُفيدع الأماوي (باللاتينية: Paedophryne amauensis) من غينيا الجديدة، البالغ طوله 7.7 مليمترات (0.30 إنشًا)، أمَّا أضخمها فهو السمندر الصيني الجنوبي العملاق (باللاتينية: Andrias sligoi) البالغ طوله 1.8 أمتار.,دارت معركة كربلاء ، المعروفة أيضًا باسم حادثة طاف ، على مدى ثلاثة أيام واختتمت في 12 أكتوبر 680 م.,False
160,"سمي الألبوم ""Loose"" الذي يعني بالعربية ""حرة"" بشكل عفوي أثناء عملية تسجيل وإعداد الألبوم، ويعتبر قرار تسميته بهذا الاسم قراراً ذكياً، فقد ساعد العنوان على انتشار الألبوم حول العالم.","كان قرارًا ذكيًا تسمية الألبوم ""فضفاض"" ، حيث ساعد في انتشار الألبوم حول العالم.",True
348,790هـ/1388م) الفقيه الأصولي المجتهد.,الفقيه الاصولي اليقظ.,True
254,يتغير الحضيض في مدار عطارد في حركته البدارية بمعدل 43 دقيقة قوسية في كل قرن، وشُرح ذلك من خلال النظرية النسبية العامة لألبرت أينشتاين في مطلع القرن العشرين.يظهر عطارد بشكل متألق عندما يراه الناظر من الأرض، ويتراوح القدر الظاهري له بين -2.3 إلى 5.7، لكن ليس من السهل رؤيته من خطوط العرض المرتفعةـ في حين يمكن رؤيته من خطوط العرض المتوسطة والدنيا، وخصوصا عندما يكون في الاستطالة العظمى له بالنسبة إلى الشمس والتي تبلغ 28.3 درجة قبل الفجر أو بعد غروب الشمس، ويمكن معرفة مواعيدها من خلال مواقع الإنترنت المختلفة.,تنص النظرية النسبية العامة لألبرت أينشتاين على أن حركة عطارد تتغير بمعدل 43 قوسًا دقيقة لكل قرن.,True
251,لعطارد أعلى قيمة للشذوذ المداري من بين جميع كواكب المجموعة الشمسية، ولديه أصغر ميل محوري من بين هذه الكواكب وهو يكمل ثلاث دورات حول محوره لكل دورتين مداريتين.,يعتبر كتاب الطبقات الكبير مرجعاً في السيرة النبوية وترجماتها وتاريخها ، حيث تناول مؤلفه السيرة النقية النقية ، وعرض الفتوى في المدينة المنورة ، وجمع القرآن الكريم.,False
184,وعند نشأتها عام 1912 سيطرت جمهورية الصين على معظم أجزاء البر الصيني ومنغوليا.,استولت جمهورية الصين على معظم أراضي الصين في عام 1912.,True
345,ومن أبرز المعالم الحضاريَّة في هذه المملكة قلعة ومسجد وقصر الحمراء الذي يُعد أحد أروع المعالم المعماريَّة في العالم، بُني لِتلبية احتياجاتٍ مُتعدِّدةٍ، فهو على الصعيد العسكري قلعةً منيعة الأسوار استطاع أُمراء غرناطة بفضلها الحفاظ على مملكتهم من الأطماع العسكرية طيلة قرنين ونيفٍ، ومن جهةٍ أُخرى صُمم لِيكون دار الإمارة ومسجداً جامعاً كبيراً، كان في أوج ازدهار المملكة منبع العُلماء ومُلتقى الدارسين من بلاد الأندلُس والمغرب، وتخرج منه عُلماء كبارٌ من أبرزهم العلَّامة الإمام الشاطبي، إبراهيم بن موسى (ت.,يعد قصر الحمراء من أروع المعالم المعمارية في العالم ، وهو من أبرز المعالم الثقافية في هذه المملكة.,True
325,وكانت هذه المملكة الصغيرة جديرةً بِأن ترث التركة الأندلُسيَّة، واستمرَّت بِفضل وعي حُكَّامها وسياساتهم المرنة زهاء مائتين وخمسين سنةً أُخرى كمُستودعٍ لِلحضارة الإسلاميَّة في الأندلُس، واضطلعت في الوقت نفسه بِذلك النضال القديم ضدَّ الممالك المسيحيَّة حتَّى لقيت مصرعها في النهاية.,تشمل التغييرات الداخلية في الفرخ البرمائي التحول من التنفس الخيشومي إلى التنفس الرئوي في بعض الأنواع.,False
64,"وقد فازت الرواية بالعديد من الجوائز، بما في ذلك وسام قارئ كاليفورنيا للناشئين، ومنحتها أسبوعية بابليشرز ويكلي، جائزة ""أفضل كتب العام"" لعام 2008.",منحت مجلة Weekly Publishers Weekly جائزة كتاب العام لعام 2008 للرواية.,True
168,لم تحذف الأغنية من الألبوم بل لا زالت موجودة بصوت نيللي فرتادو وحدها، ولكن تم تسريب النسخة القديمة من الأغنية التي ظهر بها صوت كريس مارتن في شبكة الإنترنت، يذكر أن كريس هو فنان بريطاني.,اعتقد الإغريق أن هذا الكوكب يتكون من جسدين منفصلين ، أحدهما أبولو والآخر هيرميس ، وأطلقوا عليهما كلاهما.,False
350,790هـ/1388م) الفقيه الأصولي المجتهد.,خلال عصر الفحم والبرميان ، وسعت البرمائيات نطاقها عبر الأرض ، لكنها سرعان ما بدأت في الانخفاض مع توسع نطاق وأشكال الزواحف والفقاريات الأخرى.,False
290,"كان علماء الفلك الإغريق يعتقدون أن هذا الكوكب عبارة عن جرمين منفصلين، وذلك قبل القرن الرابع قبل الميلاد، وأطلقوا على أحد هذين الجرمين تسمية ""أبولو""، واعتقدوا أنه لا يظهر للعيان إلا عند الشروق، وأطلقوا على الآخر تسمية ""هرمس""، واعتقدوا أنه لا يمكن رؤيته إلا عند الغروب.","اعتقد الإغريق أن هذا الكوكب يتكون من جسدين منفصلين ، أحدهما أبولو والآخر هيرميس ، وأطلقوا عليهما كلا من ""أبولو"" و ""هيرميس"".",True
240,فيما تستعمل اللغات التي لم تعرف الكوكب باسم محدد الاسم اللاتيني ميركوري (تلفظ ‎[ /ˈmɜrkjəri/]‏) في اللاتينية نسبة لإله التجارة الروماني.,يرتبط الاسم اللاتيني عطارد بإله التجارة الروماني.,True
413,البَرْمائِيَّات أو القَوَازِبُ، هي فقاريَّاتٌ رُباعيَّة الأطراف خارجيَّة الحرارة، اسمُها بالعربيَّة منحوتٌ من كلمتيّ «بر» و«ماء»، لِانتسابها إلى كلاها.,أحداث الرواية ترويها الشخصية الرئيسية ، فتاة تبلغ من العمر ستة عشر عامًا تعيش في عصر نهاية العالم في الحي الثاني عشر وتخضع لسلطة مركزية تسمى مبنى الكابيتول.,False
380,"الولد الصغير هو الاسم الكودي الذي أطلق على أول قنبلة ذرية ألقيت على مدينة هيروشيما اليابانية في (6) أغسطس (1945م) من قاذفة القنابل (بي-29) ""إينولا جاى"" والتي كان يقودها الكولينيل بول تيبيتس من السرب( 393) من القوات الجوية الأمريكية.",ث عميد إس أبو سيد مسلمه بين عبد الملك بين مروان بين الحكم بين أبي الاس بين أمية القرش.,False
331,فقد استمرَّت مملكة قشتالة تبتلع البلاد التابعة لِغرناطة حتَّى حاصرها الملكان الكاثوليكيان فرديناند الثاني الأرغوني وإيزابيلَّا الأولى القشتاليَّة في جُمادى الآخرة 896هـ المُوافق فيه نيسان (أبريل) 1491م، وبعد سبعة أشهُرٍ من الحصار دبَّ اليأس في نُفُوس المُسلمين وانتشر الجوع وتفشَّت الأمراض في صُفُوفهم، فأبرم آخر الأُمراء الغالب بالله مُحمَّد بن عليّ مُعاهدةً مع الملكين الكاثوليكيين قضت بِتسليم المدينة، فدخلها القشتاليُّون يوم الإثنين 2 ربيع الأوَّل 897هـ المُوافق فيه 2 كانون الثاني (يناير) 1492م، وبِذلك سقطت غرناطة وسقطت الأندلُس نهائيّاً، وأُسدل الستار على التاريخ السياسي للمُسلمين فيها.,تتشابه البرمائيات مع السحالي ، لكن هذه الأخيرة هي ثدييات وطيور ولا تحتاج إلى بيئة مائية للحفاظ على نسلها.,False
224,حيث تلعب الصناعات التكنولوجية بها دورا محوريا في اقتصاد العالم.,الاصولي الفقيه الفقيه.,False
164,"واجه ""لووس"" عدد من المشاكل منها أنه في 7 يونيو 2006، قبل طرح الألبوم، تم اختيار كريس مارتن ليضيف صوته إلى أغنية أول غود ثينغز (كوم تو أن إند) حيث غنى وصلات مع نيللي في الأغنية ولكن تم استبعاده بطلب منه وبإشعار من شركة EMI الموسيقية.","في 7 يونيو 2006 ، تم اختيار كريس مارتن لإضافة صوته إلى أغنية All Good Things (Com to an End) ، ولكن تم استبعاده من الأغنية بناءً على طلبه ، وواجه ""Lowes"" عددًا من المشكلات.",True
86,والرواية هي الأولى في سلسلة مباريات الجوع، تلتها روايتي ألسنة اللهب (الصادرة في عام 2009)، ثم الطائر المقلد (الصادرة في عام 2010).,بعد هزيمة الحزب الوطني الصيني في الحرب الأهلية ، انتقلت الحكومة إلى تايوان ، حيث أسست جمهورية الصين الشعبية.,False
