,original,paraphrase,similar
451,ظهرت أولى البرمائيَّات خلال العصر الديڤوني، مُتطوِّرةً من الأسماك لحميَّة الزعانف ذات الرئتين والأطراف العظميَّة، وهي خصائصٌ جسديَّة ساعدتها على التأقلم مع الحياة على اليابسة.,صمم Tim O'Brien غلاف The Hunger Games ، الذي طُبع في غلاف ورقي وإصدارات صوتية وإلكترونية أخرى بعد نشره في طبعة فنية من قبل Estelastic Foundation.,False
33,مباريات الجوع (بالإنجليزية: The Hunger Games)‏؛ هي رواية ديستوبية للكاتبة الأمريكية سوزان كولنز، صدرت في عام 2008.,باع الألبوم سبعة ملايين نسخة حول العالم في بداية أغسطس 2007 ، وفاز بالمركز الأول مرتين في مخطط العالم المتحد ، فضلًا عن ترشيحه لخمس جوائز.,False
8,أتقنت مي تسع لغات هي: العربية، والفرنسية والإنجليزية والألمانية والإيطالية والأسبانية واللاتينية واليونانية والسريانية.كانت مدينة النّاصرة موطن والديّ مي، فأمُّها من أصل سوريّ إلّا أنّ موطنها فهو فلسطين، ووالدها إلياس زيادة أصلهُ من لُبنان، كان معلمًا في مدرسة الأرض المقدسة، كانت مهتمةً بدراسة الّلغة العربيّة، وتعلّم الّلغات الأجنبيّة، فتميّزت ميّ منذ صباها ونشرت مقالات أدبية ونقدية واجتماعية، أما عن حياتها العاطفيّة، فقد أحبّت جبران خليل جبران على الرغم من عدم لقاءهما؛ حيث دامت المراسلات بينهما عشرين عاماً منذ عام 1911 وحتى وفاة جُبران في نيويورك عام 1931.,أدى مقتل الحسين إلى ظهور سلسلة من الكتابات الدينية والمواعظ والخطب والصلوات الخاصة بوفاته ، وألف عشرات الكتب التي تصف حادثة مقتله.,False
218,وجمهورية الصين واحدة من النمور الآسيوية الأربعة ويحتل اقتصادها المركز السادس والعشرين على مستوى العالم.,وحققت الاكتفاء الذاتي بفضل شهادة الرحالة ابن بطوطة الذي وصفها بأنها مملكة قوية رغم المعارك المستمرة مع الممالك المسيحية المجاورة.,False
170,لم تحذف الأغنية من الألبوم بل لا زالت موجودة بصوت نيللي فرتادو وحدها، ولكن تم تسريب النسخة القديمة من الأغنية التي ظهر بها صوت كريس مارتن في شبكة الإنترنت، يذكر أن كريس هو فنان بريطاني.,يشبه عطارد قمر الأرض في شكله ، حيث يحتوي على العديد من الفوهات الصدمية ، ومناطق منبسطة ملساء ، ولا يحتوي على أقمار طبيعية أو غلاف جوي ، ولكن له قلب حديدي ، مما يؤدي إلى توليد مجال مغناطيسي يساوي 1٪ من الأرض,False
23,كانَ لِمي زيادة دَور في الدِّفاع عَن حُقوق المَرأة، وبِمُطالبة المُساواة كَما أنّها استَحقّت أن تَكون رائِدة مِن رائِدات النَّهضة النِّسائية العَربيَّة الحَديثة، حَيثُ كانَت مُتطلعَة عَلى تاريخ المرأة في الفَترة التي سَبَقت سَجنها فَأكثرت مِن الكِتابة والمُحاضرات والنّدوات؛ لِلمُطالبة بِحقوق المرأة.,وبينما كانت تتطلع إلى تاريخ المرأة في الفترة التي سبقتها ، كان لي دور متزايد في الدفاع عن حقوق المرأة ، وفي المطالبة بالمساواة ، كما كانت تستحق أن تكون رائدة في نهضة المرأة العربية الحديثة.,True
133,"يعتبر الشيعة معركة كربلاء قصة تحمل معاني كثيرة ""كالتضحية والحق والحرية"" وكان لرموز هذه الواقعة حسب الشيعة دور في الثورة الإيرانية وتعبئة الشعب الإيراني بروح التصدي لنظام الشاه، وخاصة في المظاهرات المليونية التي خرجت في طهران والمدن الإيرانية المختلفة أيام عاشوراء والتي أجبرت الشاه السابق محمد رضا بهلوي على الفرار من إيران، ومهدت السبيل أمام إقامة النظام الإسلامي الشيعي في إيران وكان لهذه الحادثة أيضًا، بنظر الشيعة، دور في المقاومة الإسلامية في وجه الاحتلال الإسرائيلي في جنوب لبنان.",تنص النظرية النسبية العامة لألبرت أينشتاين على أن مقدمة عطارد يمكن رؤيتها من خطوط العرض العالية.,False
484,أبو سعيد مَسْلَمة بن عبد الملك بن مروان بن الحَكَم بن أبي العاص بن أمية الأُموي القُرشي (66 هـ-685 م/7 محرم، 121 هـ-24 ديسمبر، 738 م)، هو أمير أُموي، وقائد عسكري، ووالي، وسياسي ورجل دولة.,وأصبح شعار «يا ثورات الحسين» عاملاً مركزياً في بلورة الثقافة الشيعية ، وكانت المعركة وتفاصيلها ونتائجها تمثل قيمة روحية ذات معاني كبيرة للشيعة.,False
52,كما أشيد بحبكة الرواية وشخصياتها المُحكمة.,تم تسريب النسخة القديمة من الأغنية التي ظهر فيها صوت كريس مارتن على الإنترنت ، لكن لم تتم إزالتها من الألبوم.,False
365,ومن منهج المصنف في الكتاب أنه يذكر اسم العلم المترجم له، ونسبه، وإسلامه، ومآثره، وما ورد في فضله في ترجمة مطولة، وقد بلغ عدد الأعلام المترجم لهم 4725 علمًا، ويُعد هذا الكتاب من أقدم الكتب التي وصلت إلينا من كتب التواريخ الجامعة لرواة السنة النبوية من ثقات وضعفاء، وهو مرتب على الطبقات، وقد تكلم على الرواة جرحًا وتعديلًا.,واسم العلم المترجم له ، ونسبه ، وإسلامه ، ومآثره ، وما ورد في مزاياه في ترجمة مطولة من بعض ما جاء في الكتاب.,True
44,أمّا مباريات الجوع فهي مهرجان سنوي، يختار فيه بنظام القرعة فتى وفتاة، تتراوح أعمارهم بين 12-18 سنة، من كل مقاطعة من المقاطعات الاثنتي عشرة المحيطة بالكابيتول، ليتقاتلوا حتى الموت ضمن برنامج واقع تلفزيوني، وهناك فائز واحد فقط، هو من يستطيع البقاء على قيد الحياة.,ألعاب الجوع مهرجان سنوي ، يتم فيه اختيار فتى وفتاة بالقرعة من كل مقاطعة من المقاطعات الاثني عشر المحيطة بمبنى الكابيتول ، للقتال حتى الموت في برنامج تلفزيون الواقع ، وهناك فائز واحد فقط يمكنه البقاء. .,True
214,ويحكم الدولة رئيس البلاد الذي يعتبر رئيس الحكومة بالمشاركة مع المجلس التشريعي صاحب السلطة في إقرار القوانين بالبلاد.,وحققت الاكتفاء الذاتي بفضل شهادة الرحالة ابن بطوطة الذي وصفها بأنها مملكة قوية رغم صراعاتها مع الممالك المسيحية المجاورة.,False
76,ولقد قُدّرت مبيعات الطبعة الأولى من الرواية بحوالي مائتي ألف نسخة، وبحلول فبراير من عام 2010، وصلت مبيعات الرواية إلى ثمانمائة ألف نسخة.,بيعت الطبعة الأولى من الرواية حوالي مائتي ألف نسخة ، وبحلول فبراير من عام 2010 بيعت ثمانمائة ألف نسخة.,True
204,أما دستورياً، فلم تتنازل جمهورية الصين عن حقها الشرعي في كونها الوريث الحقيقي والممثل الشرعي لجمهورية الصين الزائلة إلا أنها في الواقع لم تهتم كثيراً بهذه القضية، حيث تختلف وجهة النظر السياسية في جمهورية الصين على السيادة الحقيقية للبلاد حيث صرح الرئيسان السابقان للبلاد لي تينج هوي وتشن شوي بيان بأن حكومة جمهورية الصين منفصلة تماماً وهي كيان مستقل سياسياً ولا تمت بأي صلة للحكومة المسيطرة على الجمهورية الشعبية ومن ثم لا يوجد داع لإعلان استقلال البلاد المستقلة بالفعل.,لا تتنازل جمهورية الصين عن حقها الشرعي في أن تكون الوريث الحقيقي والممثل الشرعي لجمهورية الصين المتلاشية ، لكنها لم تولي اهتمامًا كبيرًا لهذه القضية باعتبارها وجهة النظر السياسية في جمهورية الصين.,True
334,ولم تك مملكة غرناطة الأطولَ عُمراً بين دُول المُسلمين في الأندلُس فحسب، وإنما استطاعت أن تُحقِّق نجاحاتٍ وإنجازاتٍ حضاريَّةً باهرةً تُوازي نجاحات دُول الأندلُس التي سبقتها إن لم تتفوَّق عليها.,لم تكن مملكة غرناطة الدولة الإسلامية الأطول عمراً في الأندلس فحسب ، بل تمكنت أيضًا من تحقيق نجاحات حضارية وإنجازات ملحوظة تضاهي نجاحات دول الأندلس التي سبقتها.,True
377,"الولد الصغير هو الاسم الكودي الذي أطلق على أول قنبلة ذرية ألقيت على مدينة هيروشيما اليابانية في (6) أغسطس (1945م) من قاذفة القنابل (بي-29) ""إينولا جاى"" والتي كان يقودها الكولينيل بول تيبيتس من السرب( 393) من القوات الجوية الأمريكية.",أُسقطت القنبلة الذرية الأولى على مدينة هيروشيما اليابانية في 6 أغسطس 1945 ، وكان الاسم الرمزي هو ليتل بوي.,True
473,أصغر البرمائيَّات (والفقاريَّات عُمومًا) هو الضُفيدع الأماوي (باللاتينية: Paedophryne amauensis) من غينيا الجديدة، البالغ طوله 7.7 مليمترات (0.30 إنشًا)، أمَّا أضخمها فهو السمندر الصيني الجنوبي العملاق (باللاتينية: Andrias sligoi) البالغ طوله 1.8 أمتار.,بعد سقوط بغداد بعد حصار دام لأيام ، تم الاستيلاء على المدينة وولادة الخليفة المستو ، دارت المعركة.,False
73,ولقد قُدّرت مبيعات الطبعة الأولى من الرواية بحوالي مائتي ألف نسخة، وبحلول فبراير من عام 2010، وصلت مبيعات الرواية إلى ثمانمائة ألف نسخة.,بيعت الطبعة الأولى من الرواية حوالي مائتي ألف نسخة ، وبحلول فبراير من عام 2010 ، وصلت مبيعات الرواية إلى ثمانمائة ألف نسخة.,True
443,نظرًا لِمُتطلِّباتها التكاثُريَّة المُعقَّدة والدقيقة وجُلُودها النفيذة، يُعدُّ وُجودُ البرمائيَّات في منطقةٍ مُعيَّنةٍ إحدى مُؤشِّرات سلامة بيئة تلك المنطقة؛ ولُوحظ بدايةً من العُقُود الأخيرة لِلقرن العشرين الميلاديّ تراجُع أعداد الكثير من أنواع البرمائيَّات حول العالم نتيجة ارتفاع نسب التلوُّث وبِسبب غيرها من المُشكلات البيئيَّة.,كان هناك انخفاض في عدد السمندل في العقود الأخيرة من القرن العشرين.,True
490,برز ما بين عام 86 هـ-705 م وعام 121 هـ-738 م بخوضه الكثير من المعارك والغزوات والحملات العسكرية على كُلٍّ مِن الإمبراطورية الروميَّة البيزنطيَّة وإمبراطورية الخزر والخوارج والجراجمة، وكانت جلَّ حروبه وأغلبها على الدولة الرومية البيزنطية.,بعد مقتل فارس الدين اقطاي وقمع انتفاضات الراغبين في الحكم ، رتب البيت الداخلي لمصر وأصدر عفوًا عامًا للمماليك.,False
281,تتكوّن تركيبة عطارد من 70% معادن و 30% سليكات، وكثافته هي ثاني أكبر كثافة في المجموعة الشمسية وتقل عن كثافة الأرض بحوالي 5.515 غ/سم³ فقط.,يتكون الزئبق من 70٪ معادن و 30٪ سيليكات ، وكثافته أقل من كثافة الأرض ، لكنه ثاني أكبر كثافة في المجموعة الشمسية.,True
486,أبو سعيد مَسْلَمة بن عبد الملك بن مروان بن الحَكَم بن أبي العاص بن أمية الأُموي القُرشي (66 هـ-685 م/7 محرم، 121 هـ-24 ديسمبر، 738 م)، هو أمير أُموي، وقائد عسكري، ووالي، وسياسي ورجل دولة.,بعد مقتل فارس الدين أقطاي وقمع انتفاضات الراغبين في الحكم ، رتب البيت الداخلي لمصر وأصدر عفواً عاماً للمماليك الفارين من مصر.,False
391,"فُجرت أول قنبلة نووية للاختبار في 16 يوليو 1945 في منطقة تدعى صحراء ألاموغوردو (بالإنجليزية: Alamogordo)‏ الواقعة في ولاية نيو مكسيكو في الولايات المتحدة، وسميت القنبلة باسم القنبلة (أ) (بالإنجليزية: A-bomb)‏ وكان هذا الاختبار بمثابة ثورة في عالم المواد المتفجرة والأسلحة المدمرة، وبهذه العملية فإن شكلاً دائرياً صغيراً بحجم كف اليد يمكن أن يسبب انفجاراً تصل قوته إلى قوة انفجار تحدثه مئات الآلاف من الأطنان من مادة ال""تي إن تي"".",كانت القنبلة الذرية أول قنبلة نووية يتم اختبارها في 16 يوليو 1945 في صحراء ألاموغوردو في نيو مكسيكو ، وكانت ثورة في عالم صناعة القنابل.,True
98,وقعت المعركة بعد انتكاسات مريرة لدول ومدن العالم الإسلامي، حيث سقطت الدولة الخورازمية بيد المغول ثم تبعها سقوط بغداد بعد حصار دام أياماً فاستبيحت المدينة وقُتل الخليفة المستعصم بالله فسقطت معه الخلافة العباسية، ثم تبع ذلك سقوط جميع مدن الشام وفلسطين وخضعت لهولاكو، كانت مصر في تلك الفترة تئِنُّ من الصراعات الداخلية والتي انتهت باعتلاء سيف الدين قطز عرش مصر سنة 657 هـ / 1259 سلطانا لمماليك مصر.,تحتل جمهورية الصين المرتبة 26 في العالم من حيث الاقتصاد.,False
404,اتُهِمَت إيران مؤخراً من قبل عدد من الحكومات بأنها إحدى الدول ذات القدرة النووية.,اتهم عدد من الدول إيران بامتلاكها قدرات نووية.,True
297,"وكان الفلكيون القدماء يعتقدون بأن ""برية هرمس الهرامسة"" (باللاتينية: Solitudo Hermae Trismegisti) تُشكل ميزة أساسية من ميزات الكوكب، حيث قيل بأنها تغطي تقريباً ربع ربعه الجنوبي الشرقي.","كان يُعتقد أن ""Wilitudo Hermae Trismegisti"" هو سمة رئيسية للكوكب ، حيث قيل إنه يغطي ما يقرب من ربع ربعه الجنوبي الشرقي.",True
455,تشعَّبت البرمائيَّات خِلال العصرين الفحمي والبرمي ووسَّعت نطاق انتشارها عبر الأرض، لكنَّها سُرعان ما بدأت بِالانحسار مع توسُّع نطاق وأشكال الزواحف وغيرها من الفقاريَّات.,صمم Tim O'Brien غلاف The Hunger Games ، الذي طُبع في غلاف ورقي وإصدارات صوتية وإلكترونية أخرى.,False
22,كانَ لِمي زيادة دَور في الدِّفاع عَن حُقوق المَرأة، وبِمُطالبة المُساواة كَما أنّها استَحقّت أن تَكون رائِدة مِن رائِدات النَّهضة النِّسائية العَربيَّة الحَديثة، حَيثُ كانَت مُتطلعَة عَلى تاريخ المرأة في الفَترة التي سَبَقت سَجنها فَأكثرت مِن الكِتابة والمُحاضرات والنّدوات؛ لِلمُطالبة بِحقوق المرأة.,فضفاض هو الألبوم الثالث لمغنية البوب ​​الكندية نيللي فورتادو.,False
390,"فُجرت أول قنبلة نووية للاختبار في 16 يوليو 1945 في منطقة تدعى صحراء ألاموغوردو (بالإنجليزية: Alamogordo)‏ الواقعة في ولاية نيو مكسيكو في الولايات المتحدة، وسميت القنبلة باسم القنبلة (أ) (بالإنجليزية: A-bomb)‏ وكان هذا الاختبار بمثابة ثورة في عالم المواد المتفجرة والأسلحة المدمرة، وبهذه العملية فإن شكلاً دائرياً صغيراً بحجم كف اليد يمكن أن يسبب انفجاراً تصل قوته إلى قوة انفجار تحدثه مئات الآلاف من الأطنان من مادة ال""تي إن تي"".",كاتبة وكاتبة عربية من مواليد 1886 ، اختارت اسم مي لنفسها بعد تغيير اسمها.,False
444,نظرًا لِمُتطلِّباتها التكاثُريَّة المُعقَّدة والدقيقة وجُلُودها النفيذة، يُعدُّ وُجودُ البرمائيَّات في منطقةٍ مُعيَّنةٍ إحدى مُؤشِّرات سلامة بيئة تلك المنطقة؛ ولُوحظ بدايةً من العُقُود الأخيرة لِلقرن العشرين الميلاديّ تراجُع أعداد الكثير من أنواع البرمائيَّات حول العالم نتيجة ارتفاع نسب التلوُّث وبِسبب غيرها من المُشكلات البيئيَّة.,تُرجمت الرواية إلى 51 لغة وبيعت في ستة وخمسين دولة ومنطقة.,False
465,تتكوَّن هذه الطائفة اليوم من ثلاث رُتب: عديمات الأذيال (الضفادع والعلاجيم) وذوات الأذيال (السَّمادر أو السمادل) وعديمات الأرجل.,وتنقسم هذه الطائفة إلى ثلاث رتب: الذيل ، والذيل ، والسيقان.,True
198,في حين أصبحت جزر تايوان والبسكادورز وملحقاتهما وجزر كينمن وماتسو وبعض الجزر الصغرى الأخرى امتداداً لجمهورية الصين الزائلة بالرغم من أنها حصلت على اعتراف العديد من الدول الغربية والولايات المتحدة بها كالوريث الشرعي لجمهورية الصين مع بدايات الحرب الباردة.,وانهارت أطلال الأندلس تحت ظل هذه الدولة التي ضمت منطقة من الشرق إلى البحر الأبيض المتوسط ​​ومن الميرة والبيرة غربا.,False
282,يلجأ العلماء إلى كثافة عطارد لتحديد بنيته الداخلية، حيث يقولون أنه بسبب حجم الكوكب الصغير وعدم انضغاط مكوناته الداخلية، فإنه لا بد من أن تكون نواته ضخمة الحجم ومكونة بمعظمها من الحديد.يرجع تاريخ رصد عطارد إلى الألفية الأولى قبل الميلاد.,يستخدم العلماء كثافة عطارد لتحديد الهيكل الداخلي للكوكب الصغير ، والذي يتكون في الغالب من الحديد.,True
403,اتُهِمَت إيران مؤخراً من قبل عدد من الحكومات بأنها إحدى الدول ذات القدرة النووية.,اتهم عدد من الحكومات إيران بامتلاكها قدرة نووية.,True
297,"وكان الفلكيون القدماء يعتقدون بأن ""برية هرمس الهرامسة"" (باللاتينية: Solitudo Hermae Trismegisti) تُشكل ميزة أساسية من ميزات الكوكب، حيث قيل بأنها تغطي تقريباً ربع ربعه الجنوبي الشرقي.","الاسم العربي للبرمائيات محفور من كلمتي ""الأرض"" و ""الماء"" ، بسبب انتمائهما إلى كلتيهما.",False
76,ولقد قُدّرت مبيعات الطبعة الأولى من الرواية بحوالي مائتي ألف نسخة، وبحلول فبراير من عام 2010، وصلت مبيعات الرواية إلى ثمانمائة ألف نسخة.,سيطرت جمهورية الصين على معظم أجزاء البر الرئيسي الصيني في عام 1912.,False
491,برز ما بين عام 86 هـ-705 م وعام 121 هـ-738 م بخوضه الكثير من المعارك والغزوات والحملات العسكرية على كُلٍّ مِن الإمبراطورية الروميَّة البيزنطيَّة وإمبراطورية الخزر والخوارج والجراجمة، وكانت جلَّ حروبه وأغلبها على الدولة الرومية البيزنطية.,دارت معركة كربلاء ، المسماة أيضًا بحادثة طاف ، على مدى ثلاثة أيام واختتمت في 12 أكتوبر 680 م.,False
101,وقعت المعركة بعد انتكاسات مريرة لدول ومدن العالم الإسلامي، حيث سقطت الدولة الخورازمية بيد المغول ثم تبعها سقوط بغداد بعد حصار دام أياماً فاستبيحت المدينة وقُتل الخليفة المستعصم بالله فسقطت معه الخلافة العباسية، ثم تبع ذلك سقوط جميع مدن الشام وفلسطين وخضعت لهولاكو، كانت مصر في تلك الفترة تئِنُّ من الصراعات الداخلية والتي انتهت باعتلاء سيف الدين قطز عرش مصر سنة 657 هـ / 1259 سلطانا لمماليك مصر.,أعلن رئيس جمهورية الصين أن بلاده دولة مستقلة ذات سيادة ولها حق إدارة كل من تايوان وجمهورية الصين الشعبية.,False
65,"وقد فازت الرواية بالعديد من الجوائز، بما في ذلك وسام قارئ كاليفورنيا للناشئين، ومنحتها أسبوعية بابليشرز ويكلي، جائزة ""أفضل كتب العام"" لعام 2008.",منحت مجلة Weekly Publishers Weekly جائزة كتاب العام لعام 2008 للرواية.,True
167,لم تحذف الأغنية من الألبوم بل لا زالت موجودة بصوت نيللي فرتادو وحدها، ولكن تم تسريب النسخة القديمة من الأغنية التي ظهر بها صوت كريس مارتن في شبكة الإنترنت، يذكر أن كريس هو فنان بريطاني.,تم تسريب النسخة القديمة من الأغنية التي ظهر فيها صوت كريس مارتن على الإنترنت ، لكن لم تتم إزالتها من الألبوم.,True
220,وجمهورية الصين واحدة من النمور الآسيوية الأربعة ويحتل اقتصادها المركز السادس والعشرين على مستوى العالم.,كانت هذه المملكة الصغيرة جديرة بالاستيلاء على تراث الأندلس ، وبفضل حكامها وسياساتهم المرنة ، استمرت نحو مائتين وخمسين عامًا أخرى كمستودع للحضارة الإسلامية في الأندلس.,False
